[
  {
    "scene_id": "sc_001",
    "script_id": "scr_20260503_190902",
    "start_sec": 0,
    "end_sec": 33,
    "objective": "hook",
    "narration": "대한민국 수출 시장에서 최근 이례적인 숫자가 포착되었습니다. 단일 월 수출 실적이 역대급 기록을 경신하며 시장의 관심을 집중시키고 있습니다. 왜 지금 우리 수출 지표에 주목해야 하는지 그 이유를 살펴봅니다.",
    "subtitle_text": "대한민국 수출 시장에서 최근 이례적인 숫자가…",
    "claim_ids": [
      "evt_001_cl_03"
    ],
    "visual_modes": [
      "stock_video",
      "headline_card"
    ],
    "asset_ids": []
  },
  {
    "scene_id": "sc_002",
    "script_id": "scr_20260503_190902",
    "start_sec": 33,
    "end_sec": 66,
    "objective": "today_core",
    "narration": "지난 4월 우리나라의 수출액은 총 859억 달러를 기록한 것으로 집계되었습니다. 이는 지난해 같은 달과 비교했을 때 무려 48%나 급등한 수치입니다. 이번 실적은 우리나라 수출 역사상 역대 두 번째로 높은 기록이라는 점에서 의미가 큽니다.",
    "subtitle_text": "지난 4월 우리나라의 수출액은 총 859억…",
    "claim_ids": [
      "evt_001_cl_01",
      "evt_001_cl_02",
      "evt_001_cl_03"
    ],
    "visual_modes": [
      "stock_video",
      "headline_card"
    ],
    "asset_ids": []
  },
  {
    "scene_id": "sc_003",
    "script_id": "scr_20260503_190902",
    "start_sec": 66,
    "end_sec": 99,
    "objective": "background",
    "narration": "이러한 폭발적인 수출 성장의 중심에는 글로벌 산업 지형의 변화가 자리 잡고 있습니다. 전 세계적으로 인공지능 인프라 구축을 위한 대규모 투자가 이어지고 있기 때문입니다. 하드웨어 수요가 급증하면서 우리 주력 품목의 몸값도 함께 높아지는 추세입니다.",
    "subtitle_text": "이러한 폭발적인 수출 성장의 중심에는 글로벌…",
    "claim_ids": [],
    "visual_modes": [
      "stock_video",
      "chart"
    ],
    "asset_ids": []
  },
  {
    "scene_id": "sc_004",
    "script_id": "scr_20260503_190902",
    "start_sec": 99,
    "end_sec": 132,
    "objective": "evidence",
    "narration": "품목별로 보면 반도체의 활약이 독보적인 수준을 보여주었습니다. 반도체 수출액은 보도에 따르면 1년 만에 3배 가까이 늘어나며 전체 실적을 사실상 견인했습니다. 주력 산업의 회복세가 지표상으로 확연히 증명된 셈입니다.",
    "subtitle_text": "품목별로 보면 반도체의 활약이 독보적인 수준…",
    "claim_ids": [
      "evt_001_cl_04"
    ],
    "visual_modes": [
      "stock_video",
      "chart"
    ],
    "asset_ids": []
  },
  {
    "scene_id": "sc_005",
    "script_id": "scr_20260503_190902",
    "start_sec": 132,
    "end_sec": 165,
    "objective": "mechanism",
    "narration": "AI 모델이 고도화될수록 이를 뒷받침할 고성능 메모리 반도체의 수요는 기하급수적으로 늘어납니다. 이러한 수요는 단순한 물량 확대를 넘어 수출 단가 자체를 끌어올리는 효과를 가져옵니다. 결국 반도체 단가 상승과 물량 증가가 결합되며 기록적인 수출액을 만들어낸 메커니즘입니다.",
    "subtitle_text": "AI 모델이 고도화될수록 이를 뒷받침할 고성…",
    "claim_ids": [],
    "visual_modes": [
      "stock_video",
      "chart"
    ],
    "asset_ids": []
  },
  {
    "scene_id": "sc_006",
    "script_id": "scr_20260503_190902",
    "start_sec": 165,
    "end_sec": 198,
    "objective": "etf_link",
    "narration": "이러한 수출 호조세와 연동된 산업 흐름은 시장의 다양한 투자 상품에도 투영됩니다. 투자자들은 국내 반도체 대장주나 관련 장비 기업을 포괄하는 반도체 ETF를 통해 산업 전반의 성장세에 주목하기도 합니다. 특정 기업의 변동성보다 산업 생태계 전체의 수출 경쟁력을 추종하는 관점입니다.",
    "subtitle_text": "이러한 수출 호조세와 연동된 산업 흐름은 시…",
    "claim_ids": [],
    "visual_modes": [
      "stock_video",
      "chart"
    ],
    "asset_ids": []
  },
  {
    "scene_id": "sc_007",
    "script_id": "scr_20260503_190902",
    "start_sec": 198,
    "end_sec": 231,
    "objective": "implication",
    "narration": "이번 데이터는 한국 경제의 펀더멘털이 반도체 경기에 얼마나 강력하게 동조되어 있는지를 다시 한번 확인시켜 줍니다. 수출 다변화라는 장기적 과제는 여전하지만, 주력 산업의 기술 경쟁력이 실물 경제의 든든한 버팀목이 되고 있다는 점이 중요합니다. 기업들의 이익 개선 기대감이 숫자로 확인되었다는 점에 주목해야 합니다.",
    "subtitle_text": "이번 데이터는 한국 경제의 펀더멘털이 반도체…",
    "claim_ids": [],
    "visual_modes": [
      "stock_video",
      "chart"
    ],
    "asset_ids": []
  },
  {
    "scene_id": "sc_008",
    "script_id": "scr_20260503_190902",
    "start_sec": 231,
    "end_sec": 264,
    "objective": "risk",
    "narration": "긍정적인 지표 뒤에는 우리가 경계해야 할 리스크 요소도 분명히 존재합니다. 특정 품목에 대한 수출 의존도가 과도하게 높아지면 해당 산업의 사이클에 따라 국가 경제 전체가 흔들릴 수 있습니다. 글로벌 공급망의 변화나 주요국의 자국 우선주의 정책이 변수가 될 수 있음을 잊지 말아야 합니다.",
    "subtitle_text": "긍정적인 지표 뒤에는 우리가 경계해야 할 리…",
    "claim_ids": [],
    "visual_modes": [
      "stock_video",
      "chart"
    ],
    "asset_ids": []
  },
  {
    "scene_id": "sc_009",
    "script_id": "scr_20260503_190902",
    "start_sec": 264,
    "end_sec": 297,
    "objective": "risk",
    "narration": "글로벌 금리 환경의 불확실성과 지정학적 긴장감도 대외 의존도가 높은 우리 수출에 부담이 될 수 있습니다. 환율의 급격한 변동은 수출 기업들의 실질적인 채산성에 직접적인 영향을 미치는 요인입니다. 거시 경제 환경이 예상보다 비우호적으로 흐를 가능성에 항상 대비해야 합니다.",
    "subtitle_text": "글로벌 금리 환경의 불확실성과 지정학적 긴장…",
    "claim_ids": [],
    "visual_modes": [
      "stock_video",
      "chart"
    ],
    "asset_ids": []
  },
  {
    "scene_id": "sc_010",
    "script_id": "scr_20260503_190902",
    "start_sec": 297,
    "end_sec": 330,
    "objective": "what_to_watch",
    "narration": "앞으로 우리가 확인해야 할 핵심 지표는 반도체 수출의 지속 가능성입니다. 특히 AI 인프라 투자 규모가 정점을 지나 둔화되는 신호가 나오는지 면밀히 관찰해야 합니다. 다음 달 발표될 수출 통계에서 반도체 외 다른 품목들의 회복세가 동반되는지도 체크포인트입니다.",
    "subtitle_text": "앞으로 우리가 확인해야 할 핵심 지표는 반도…",
    "claim_ids": [],
    "visual_modes": [
      "stock_video",
      "chart"
    ],
    "asset_ids": []
  },
  {
    "scene_id": "sc_011",
    "script_id": "scr_20260503_190902",
    "start_sec": 330,
    "end_sec": 363,
    "objective": "close",
    "narration": "4월 수출은 AI 열풍에 힘입어 역대급 성적을 기록하며 우리 경제의 기초 체력을 입증했습니다. 숫자가 증명하는 시장의 변화를 냉철하게 분석하고 본인만의 투자 원칙을 지켜나가는 것이 중요합니다. 오늘 분석이 여러분의 현명한 투자 판단에 도움이 되길 바랍니다.",
    "subtitle_text": "4월 수출은 AI 열풍에 힘입어 역대급 성적…",
    "claim_ids": [],
    "visual_modes": [
      "stock_video",
      "headline_card"
    ],
    "asset_ids": []
  }
]